n_authors,Session,Order,abstract_number,category,article-title,surname1,given-names1,aff1,abstract,fn-group,surname2,given-names2,aff2,surname3,given-names3,aff3,surname4,given-names4,aff4,surname5,given-names5,aff5,surname6,given-names6,aff6,surname7,given-names7,aff7,surname8,given-names8,aff8,surname9,given-names9,aff9,surname10,given-names10,aff10,surname11,given-names11,aff11,surname12,given-names12,aff12,surname13,given-names13,aff13,surname14,given-names14,aff14,surname15,given-names15,aff15,surname16,given-names16,aff16,surname17,given-names17,aff17
6,10,17,50,"Contributed Poster","Deep retinal layer microvasculature alterations in first episode and chronic schizophrenia",Fradkin,"Samantha I.","Department of Psychology, University of Rochester, Rochester, NY, USA","People with schizophrenia (SZ) demonstrate retinal microvasculature alterations that are similar to those observed in individuals with neurodegenerative disorders. Initial findings indicate that these changes are present in the superficial layer in SZ. This study examined whether changes are also present in the deep retinal layer level (DRL). Twenty-six individuals with SZ (10 with first episode psychosis [FEP]) and 37 healthy controls (HCs; 17 age-matched to FEP group) completed optical coherence tomography angiography scans. Compared to controls, people with SZ demonstrated reduced DRL perfusion density (ps < 0.04) and vessel diameter (ps < 0.01) in both eyes, and, in the left eye only, reduced vessel length and fractal dimension (ps = 0.01). We then tested for an illness progression effect by determining the degree to which the original 4 group means were characterized by a polynomial (linear) trend, using the following contrast coefficients: non-FEP SZ (-2), FEP (0), older controls (0), young controls (2). The hypothesized pattern was observed to a significant or trend level degree for 7 out of 8 variables, with effect sizes ranging from small to large. Findings also indicated that, within the SZ group, reduced DRL perfusion density and vessel length were associated with reductions in (previously reported) superficial layer indices (ps < .001). Overall, findings suggest that alterations in retinal microvasculature are present in both the superficial and DRL in SZ.","Research reported was supported by the NEI of the NIH under Award Number T32EY007125. The content is solely the responsibility of the authors and does not necessarily represent the official views of the NIH.","Bannai ","Deepthi ","Department of Psychiatry, Beth Israel Deaconess Medical Center, Boston, MA, USA","Lizano ",Paulo,"Department of Psychiatry, Beth Israel Deaconess Medical Center, Boston, MA, USA; Department of Psychiatry, Harvard Medical School, Boston, MA, USA ","Lai ",Adriann,"Maryland Psychiatric Research Center, University of Maryland, Baltimore, MD, USA",Crosta,"Christen ","Department of Cell Biology and Neuroscience, Rutgers University, Piscataway, NJ, USA","Silverstein ","Steven M. ","Departments of Psychiatry, Neuroscience, & Ophthalmology, University of Rochester Medical Center, Rochester, NY, USA; Center for Visual Science, University of Rochester, Rochester, NY, USA",,,,,,,,,,,,,,,,,,,,,,,,,,,,,,,,,
2,10,18,51,"Contributed Poster","Chromatic Adaptation to Heterochromatic Illumination",Hellwig,Luke,"Rochester Institute of Technology","Heterochromatic viewing enviroments—where scenes are illuminated by two or more colors of light—are a common tool for experiments studying chromatic adaptation and color (in)constancy.  This study presents a new method for separating sensory (retina-based) chromatic adaptation from cognitive mechanisms in a heterochromatic viewing environment. Using a large, bipartite light booth lit by two separate 7-channel LED systems, observers were adapted to uniform and mixed illuminations of simulated illuminant A, illuminant D65, and 12000 K daylight. A psychophysical staircase method determined observers’ white points and their state of sensory adaptation along the daylight and Planckian loci under each heterochromatic or single-color lighting condition. Under heterochromatic conditions, observers’ state of chromatic adaptation fell in between the points of chromatic adaptation when adapted to each individual light source, although there was significant variation between observers. These results suggest that observers’ white points should be individually determined for studies of color perception in heterochromatic environments using methods similar to those used in this study. Further research will then allow us to model how cognitive discounting of the illumination color sits on top of the sensory adaptation measured here. ",None,Fairchild,"Mark D.","Rochester Institute of Technology",,,,,,,,,,,,,,,,,,,,,,,,,,,,,,,,,,,,,,,,,,,,,
4,10,19,52,"Contributed Poster","Eye-tracking while learning greebles.",Herbert,"Andrew Mark","RIT, Psychology","	There has been a lot of attention on so-called ‘adversarial images’ that fool machine learning models (MLM). Manipulations to an image or including an unexpected object in a scene can severely disrupt object labeling and parsing by state-of-the-art MLM such as convolutional neural networks (CNN). In contrast, human observers may not even notice these changes, highlighting a significant gap between the robustness of human vision and CNNs. One well-studied class of novel objects are ‘Greebles,’ introduced by Gauthier and Tarr (1997; Gauthier et al., 1998). A large number of ‘families’, ‘genders’ and individuals can be created by systematically varying the arrangements and shapes of Greeble components. We report on eye-tracking (SMI iRed 250) participants as they are taught to recognize Greebles following the procedure described by Gauthier, Tarr and colleagues. Greeble expertise is assessed using a naming task and a verification task. Once an individual became a Greeble ‘expert’ we assessed their tolerance for rotations of the Greebles around the y-axis. The pattern of eye movements when learning and being tested on the Greebles are compared to the output of CNNs trained to recognize Greebles. ","RIT Global Cybersecurity Institute",Pandurangan,Archana,"RIT, Psychology",Patel,"Ankita Girish","RIT, Computer Engineering",Merkel,"Cory E.","RIT, Computer Engineering",,,,,,,,,,,,,,,,,,,,,,,,,,,,,,,,,,,,,,,
3,10,20,53,"Contributed Poster","Achromatic biases in noise images",Joyce,Daniel,"University of Nevada, Reno","In a previous study, Winkler et al. (Current Bio 2015) examined the effects of luminance on the perceived color categories selected for uniform square patches. When the square was equiluminant with the background, the patch appeared colored as soon as it was detected, while for increments or decrements, the range of chromaticities that were classified as achromatic was expanded and more strongly along bluish axes. Here we extended these results to examine the color appearance of spatially varying patterns, which contain a wide range of luminance levels. The images were 1/f luminance noise and were briefly alternated with a gray background with the same mean luminance. The noise was shown on each trial with a uniform chromaticity, which was varied across trials over a grid of values spanning the LvsM and SvsLM cone-opponent axes. Observers categorized each noise image as gray or one of the four unique (RGBY) or binary (RB,BG,GY,YR) hues. The perceived achromatic gamut for the noise again tended to vary along bluish-yellowish directions, but was markedly broader compared to the uniform patches. The broadening of the gray category may partly reflect attributions of some of the color to the illuminant, a tendency which may be stronger in the spatially variegated patterns.","Supported by EY-010834",Bennett,Emersongrace,"University of Nevada, Reno",Webster,Michael,"University of Nevada, Reno",,,,,,,,,,,,,,,,,,,,,,,,,,,,,,,,,,,,,,,,,,
5,10,21,54,"Contributed Poster","Detecting spaceflight associated neuro-ocular syndrome (SANS) using light-weight convolutional neural networks",Kamran,"Sharif Amit","Human-Machine Perception Laboratory, Department of Computer Science and Engineering, University of Nevada, Reno, Nevada, United States","Spaceflight-associated neuro-ocular syndrome (SANS) is a collection of neuro-ophthalmic findings that occurs in astronauts as a result of prolonged microgravity exposure in space. Due to limited resources on board long-term spaceflight missions, early disease diagnosis and prognosis of SANS become unviable. Moreover, the current retinal imaging techniques onboard the international space station (ISS), such as optical coherence tomography (OCT), ultrasound imaging, and fundus photography, require an expert to distinguish between SANS and similar ophthalmic diseases. With the advent of Deep Learning, diagnosing diseases (such as diabetic retinopathy) from structural retinal images are being automated. In this study, we propose a lightweight convolutional neural network incorporating an EfficientNet encoder for detecting SANS from OCT images. We used 6303 OCT B-scan images for training/validation (80%/20% split) and 945 for testing. Our model achieved 84.2% accuracy on the test set, i.e., 85.6% specificity, and 82.8% sensitivity. Moreover, it outperforms two other state-of-the-art pre-trained architectures, ResNet50-v2 and MobileNet-v2, by 21.4% and 13.1%. Additionally, we use GRAD-CAM to visualize activation maps of intermediate layers to test the interpretability of our model's prediction. The proposed architecture enables fast and efficient prediction of SANS-like conditions for future long-term spaceflight mission in which computational and clinical resources are limited.","NASA Grant [80NSSC20K183]: A Non-intrusive Ocular Monitoring Framework to Model Ocular Structure and Functional Changes due to Long-term Spaceflight.",Hossain,"Khondker Fariha","Human-Machine Perception Laboratory, Department of Computer Science and Engineering, University of Nevada, Reno, Reno, Nevada, United States","Ong, MD.",Joshua,"Michigan Medicine, University of Michigan, Ann Arbor, Michigan, United States","Lee, MD.","Andrew G.","Center for Space Medicine, Baylor College of Medicine, Houston, Texas, United States; Department of Ophthalmology, Blanton Eye Institute, Houston Methodist Hospital, Houston, Texas, United States; The Houston Methodist Research Institute, Houston Methodist Hospital, Houston, Texas, United States; Departments of Ophthalmology, Neurology, and Neurosurgery, Weill Cornell Medicine, New York, New York, United States; Department of Ophthalmology, University of Texas Medical Branch, Galveston, Texas, United States; University of Texas MD Anderson Cancer Center, Houston, Texas, United States; Texas A&M College of Medicine, Texas, United States; Department of Ophthalmology, The University of Iowa Hospitals and Clinics, Iowa City, Iowa, United States","Tavakkoli, PhD.",Alireza,"Human-Machine Perception Laboratory, Department of Computer Science and Engineering, University of Nevada, Reno, Reno, Nevada, United States",,,,,,,,,,,,,,,,,,,,,,,,,,,,,,,,,,,,
5,10,22,55,"Contributed Poster","Development and validation of a virtual reality based toolkit to assess functional vision in  Ultra Low Vision ",Kartha,Arathy,"Johns Hopkins University"," Ultra-Low Vision (ULV) refers to a level of vision that is ≦ 20/1600. There are a growing number of vision restoration treatments that recruit people with ULV or restore vision to the ULV level. At present, limited standardized outcome measures are available to assess visual potential before and after such vision restoration treatments. The ULV toolkit was developed as a standardized outcome measure for people with ULV. Three virtual reality (VR) based modules were developed to assess visual information gathering, hand-eye coordination and wayfinding in people with ULV. Each module consisted of a range of visually guided tasks related to activities of daily life (e.g., direction of motion of cars, flipping a light switch, boarding a train). Each correct/incorrect response was scored as ‘1’/ ‘0’. These raw scores were then analyzed to estimate item difficulty (item measure) and person ability (person measure). Item measures showed a wide range of difficulty levels that can be used to evaluate visual performance in people with ULV. Person measures were correlated with estimated logMAR visual acuity as well as completion rates, number of collisions and reaction times. This study bridges a big gap in the field of ULV where little is known about visual potential and usefulness in activities of daily life. VR provides portability and consistency for testing across participants with ULV thereby allowing for standardization of measurements across vision restoration studies.","NEI R01EY028452 (GD), K99EY033031(AK), Research to Prevent Blindness",Sadeghi,Roksana,"Johns Hopkins University",Swanson,Thom,BaltiVirtual,Gee,Will,BaltiVirtual,Dagnelie,Gislin,"Johns Hopkins University",,,,,,,,,,,,,,,,,,,,,,,,,,,,,,,,,,,,
4,10,23,56,"Contributed Poster","A direct measure of adaptation and visual salience","Kuppuswamy Parthasarathy",Mohana,"University of Nevada, Reno","One hypothesized function of adaptation is to increase the salience of novel targets by discounting the properties of the ambient environment. Previous studies have suggested this by finding faster search times for novel targets when searching on backgrounds observers are currently adapted to. However, this provides only an indirect measure of salience. Here, we developed a more direct measure of the impact of adaptation on feature salience. Backgrounds were oriented 1/f noise images with power confined within 15 deg of horizontal or vertical. Targets were 5 c/deg Gabor patches centered on the 8 deg backgrounds. Observers simultaneously adapted to the horizontal or vertical backgrounds shown on the left or right of fixation. A 250ms test probe then showed the Gabor patch on the same background (horizontal or vertical) on both sides. The target orientation was adjusted on one side until it appeared as conspicuous as a fixed target on the other side. Settings were made for fixed targets ranging from 10 to 45 deg from the backgrounds. For most conditions/observers, the salience matches required a smaller orientation offset on the same- vs. different-adapt background. These results support a functional role of adaptation in highlighting novelty by potentially “unmasking” the target from its background, and emphasize the importance of considering adaptation aftereffects not only for isolated targets but within the stimulus contexts they are embedded in.",CA-237827,"Lee Corsini",Kassandra,"University of Nevada, Reno","K Abbey",Craig,"University of California, Santa Barbara","A. Webster",Michael,"University of Nevada, Reno",,,,,,,,,,,,,,,,,,,,,,,,,,,,,,,,,,,,,,,
3,10,24,57,"Contributed Poster","Learned rapid adaptation to environmental color changes generalize to a large range of colors",Li,Yanjun,"University of Minnesota","When the environment changes color, vision adapts, and the world gradually appears less tinted. For repeated color changes, vision may learn to adapt faster to maintain accurate perception. We previously reported that wearing red glasses repeatedly caused the world to appear less and less reddish when the glasses were first put on, as measured by the appearance of unique yellow. Here, we tested the appearance of a larger range of colors. 13 observers wore red glasses for 5hr/day for 5 days. Observers were tested with pairs of 1.5 deg filled color circles, centered within a 6deg black square on a background image. 13 colors were chosen from LAB space comprising unique and intermediate hues at two contrast levels, and one gray. Observers rated the difference between each possible color pair on a scale of 0 to 9. Observers performed the task before and immediately after putting the glasses on, and after 25, 50 and 75 min of wear. Wearing red glasses caused all colors to appear reddish and be rated as relatively similar. As observers adapted, colors gradually regained more normal appearance, and the similarity between color pairs decreased. Critically, over days, color pairs appeared more dissimilar immediately after putting on the glasses (p<1e-6). Multi-dimensional scaling analysis of the similarity data revealed a uniform expansion of color space across days. Thus, observers learned to immediately adjust their perception of many colors with repeated experience. ",NSF-1558308,Tregillus,Katherine,"University of Minnesota",Engel,"Stephen ","University of Minnesota",,,,,,,,,,,,,,,,,,,,,,,,,,,,,,,,,,,,,,,,,,
7,10,25,58,"Contributed Poster","Spatial-frequency-selective enhancement of visual sensitivity from saccade dynamics",Li,"Yuanhao H.","University of Rochester","Eye movements transform a spatial scene into luminance modulations on the retina. Recent work has shown that this transformation is highly structured: within human temporal sensitivity, saccades deliver power that increases in proportion to spatial frequency (SF) up to a critical frequency and remains constant beyond that. Importantly, the critical SF increases with decreasing amplitude. Therefore, at sufficiently low SFs, larger saccades effectively deliver stronger input signals to the retina. Here we tested whether this input reformatting has the predicted perceptual consequences, by examining how large and small saccades (6o & 1o) affect contrast sensitivity. We measured relative sensitivity at two SFs: a reference (0.5 cpd), equal to the critical SF for the small saccade, and a probe at either a lower or higher SF (0.1/2.5 cpd). We predicted that large saccades enhance visibility only when the probe has a lower SF than the reference. Subjects (N=7) made instructed saccades while presented with a plaid of overlapping orthogonal gratings at the two SFs and reported which grating was more visible. Results closely follow theoretical predictions: psychometric functions following small and large saccades only differed with the lower SF probe, in which case the larger saccade significantly enhanced visibility. In sum, saccades enable selectivity not only in the spatial domain, but also in the spatial-frequency domain.","This work was supported by Meta Reality Labs and National Institutes of Health grants EY018363 (MR) and EY07977 (JV).",Cox,"Michele A.","University of Rochester",Intoy,Janis,"University of Rochester",Victor,Jonathan,"Feil Family Brain and Mind Research Institute, Weill Cornell Medical College",Yang,Bin,"University of Rochester",Zhao,Zhetuo,"University of Rochester",Rucci,Michele,"University of Rochester",,,,,,,,,,,,,,,,,,,,,,,,,,,,,,
5,10,26,59,"Contributed Poster","A unifying framework for perceptual decision-making",Lin,Ying,"University of Rochester","Perceptual decision making (PDM) has been studied using two approaches. Threshold measurement is predominant used in psychophysics, while reaction times (RT) with associated models have been used to estimate components of PDM (i.e., drift rate). To test if these two approaches reflect overlapping mechanisms, we conducted 3 experiments: a motion, a static orientation, and a dynamic orientation task. DT is the shortest stimulus presentation time sufficient to make accurate perceptual decisions. RTs and choices were fitted by a drift diffusion model (DDM). We expected a close relationship between DTs and drift rates, allowing us to accurately predict DTs from RT. In the motion task, we found a close relation between the empirical DTs and the DTs predicted by the DDM. Surprisingly, in the static task, there was little correlation between the two; DTs, improved monotonically with higher contrast, but drift rates saturated at 6%. We hypothesize that this mismatch is due to the information being available immediately in the static task, without needing to accumulate new evidence. Thus, we developed a novel dynamic orientation task that mimics the dynamic nature of the motion task and found a similar relation between DTs and drift rates. In summary, we show a close link between DTs and drift rate for the two dynamic tasks. This result supports the conceptualization of drift rate as a proxy for perceptual sensitivity but only for task where new information becomes available over time.",None,Chen,Zhen,"University of Rochester",Reynoso,Jose,"The City College of New York ",Haefner,Ralf,"University of Rochester",Tadin,Duje,"University of Rochester",,,,,,,,,,,,,,,,,,,,,,,,,,,,,,,,,,,,
4,10,27,60,"Contributed Poster","Bayesian inference and adaptation in neural responses",Manalansan,Jake,"University of Nevada Reno","Many of the perceptual changes induced by adaptation can be captured in a Bayesian framework, in which adaptation renormalizes neural responses to weak or strong stimuli, consistent with correcting the likelihood to match the prior (Emery and Webster VSS 2020). We explored what this model implies about Bayesian estimation at the level of an individual neuron or channel. The prior corresponds to what the neuron expects to see, but the adaptation causes responses to match what it expects. If the decoder does not “know” the neuron’s adaptation state (Series et al 2009), these adjustments effectively flatten priors for dimensions the neuron adapts to, preserving expectations only for information that it does not adapt to, such as how signals deviate from the predicted value.  Bayesian-like estimates of these deviations can be computed within the neuron because the shape of the prior is instantiated in the neuron’s contrast response function (CRF). For example, for a Gaussian prior the corresponding CRF is a cumulative Gaussian. Steeper CRFs bias responses more toward the mean. The biases approximate but do not equal the Bayesian posterior. If, like adaptation, the decoding does not account for this approximation, then the interpreted stimulus value is distorted relative to the Bayes estimate. This may underlie the distortions evident in some perceptual dimensions, such as nonlinearities in perceived contrast.","Supported by EY010834",Emery,Kara,"New York University",Rudd,Michael,"University of Nevada Reno",Webster,Michael,"University of Nevada Reno",,,,,,,,,,,,,,,,,,,,,,,,,,,,,,,,,,,,,,,
5,10,28,61,"Contributed Poster","Quantifying Visual Snow Symptoms with a Matching Task",Montoya,Samantha,"University of Minnesota, Graduate Program in Neuroscience","The primary symptom of Visual Snow Syndrome (VSS) is a veil of dots/static flickering across the entire visual field. VSS is a serious but poorly understood disorder (prevalence 1.4-3.3%). Symptoms of VSS can interfere with daily tasks like driving and reading. However, few studies have examined VSS, and quantitative measurements of symptoms are lacking. We developed a matching task in which participants with VSS adjusted parameters of simulated visual snow on a computer screen; participants modified the contrast, density, speed, and size of an array of dots to match their visual snow. Simulated snow was generated by random independent draws from a binary distribution controlled by the contrast parameter. Snow density was adjusted by setting a proportion of pixels equal to the background luminance. The speed setting determined the lifetime of each snow element, after which it was replaced. Dot size was adjusted by moving closer or further from the display and recording the viewing distance, as perceived snow elements were generally smaller than one pixel viewed from 0.5 m. Individuals with VSS said the simulated snow closely resembled their perceived snow, and parameter settings were consistent across trials. Simulated snow contrast settings were relatively low and dot size was relatively small. This task provides a quantitative assessment of visual snow percepts, which may facilitate assessment of treatments/therapies and testing of hypotheses about underlying mechanisms.","This work was supported by funding from the National Institutes of Health and the National Science Foundation (T32 EY025187, DGE-1734815, R25 NS117356)",Lee,Michael,"University of Minnesota, Department of Ophthalmology and Visual Neurosciences",Mulder,Carter,"University of Minnesota, Department of Psychiatry and Behavioral Sciences",Engel,Stephen,"University of Minnesota, Department of Psychology",Schallmo,Michael-Paul,"University of Minnesota, Department of Psychiatry and Behavioral Sciences",,,,,,,,,,,,,,,,,,,,,,,,,,,,,,,,,,,,
