n_authors,Session,Order,abstract_number,category,article-title,surname1,given-names1,aff1,abstract,fn-group,surname2,given-names2,aff2,surname3,given-names3,aff3,surname4,given-names4,aff4,surname5,given-names5,aff5,surname6,given-names6,aff6,surname7,given-names7,aff7,surname8,given-names8,aff8,surname9,given-names9,aff9,surname10,given-names10,aff10,surname11,given-names11,aff11,surname12,given-names12,aff12,surname13,given-names13,aff13,surname14,given-names14,aff14,surname15,given-names15,aff15,surname16,given-names16,aff16,surname17,given-names17,aff17
3,8,2,29,"Invited Talk","Early prediction of multiple sclerosis using scanning laser ophthalmoscopy (SLO) video sequence data with a Deep Learning (DL) based approach",Xing,Joe,"C. Light Technologies, Inc.","Introduction: Multiple Sclerosis (MS) is a chronic immune-mediated inflammatory disease (IMID) of the central nervous system (CNS). Early identification of MS, especially as a screening method for at-risk individuals, is crucial to delay disease progression and improve patient outcomes by preventing future irreversible neurologic damage. In this work, we utilize well-validated tracking scanning laser ophthalmoscope (TSLO) image to predict MS compared to the unaffected controls. While traditional Machine Learning (ML) methods, such as Logistic Regression (LR), have demonstrated a strong predictive power [Mauro F. Pinto et al., 2020] in disease identification, we propose the use of a novel DL based model. Though the use of Deep Neural Network (DNN), this model can have a much higher learning capacity to capture latent features embedded in the retinal images. We hypothesize that such latent information, often hidden in ML feature engineering processes, plays an important role for the prediction of disease and can be well represented by DL models. Objectives: To establish a DL based model capable of learning latent image features to provide predictive power for the presence of MS. Aims: Utilize a deep convolutional neural network to extract the retinal coding and implement a recurrent neural network to learn the temporal correlations in video sequences. Methods: Our approaches were tested using a 250-subject MS/control database collected at the UCSF. Patients with Expanded Disability Status Scale (EDSS)< 4 are compared to healthy subjects. Both raw retinal images and the frequency and spatial patterns of the eye motion are combined to construct a hybrid image, denoted as “retinal coding”, and directly fed to the DL model for training and testing. Results: Preliminary results on predictive power were measured using Area-under-Curve (AUC) of the Receiver Operating Characteristics (ROC) curve, sensitivity, and specificity, as well as an F-1 score. We observe an AUC of 0.920, sensitivity of 0.90, specificity of 0.89 and F-1 score of 0.89 using the DL model to distinguish MS from controls, which outperforms the baseline LR model by 24%. Conclusions: This work can be considered as a proof-of-concept concerning the possibility of identifying MS disease using a DL based approach. The results demonstrate the possibility of predicting early-stage MS and understanding disease’s dynamics. Such end-to-end model could be generalizable and trained on other disease states.",None,Green,Ari,"University of California San Francisco",Sheehy,Christy,"C. Light Technologies, Inc.",,,,,,,,,,,,,,,,,,,,,,,,,,,,,,,,,,,,,,,,,,
17,8,3,30,"Invited Talk","Seeking Answers through a keyhole: Harnessing the Synergy of Dynamic OCT/OCT Angiography and Adaptive Optics SLO for Retinal Assessment of Systemic Disease ",Rosen,Richard,"New York Eye and Ear Infirmary","The retina is our only non-invasive access to microworld of the body’s capillaries and cellular activities. Leveraging the multimodal synergy of combining dynamic methods of OCT/OCTA, with Adaptive Optics SLO, clinicians have new opportunities to better appreciate some of the complexities of human disease. Serial OCTA imaging can reveal inconsistencies in retinal perfusion not appreciated on single images and can be used to measure activity status of sickle cell microvasculopathy. This approach facilitates earlier detection and immediate assessment of disease burden. AOSLO imaging provides cellular level resolution for confirmation of these OCTA events. En face OCT reflectance images which accompany OCTA studies offer a glimpse of the macrophage-like cellular activity above the retinal surface which responds to systemically instigated vascular events below. The complementary use of AOSLO to characterize morphology of these cells provides clues to their activation status and potential role in tissue maintenance and repair. Features of clinical OCT/OCTA interpreted by AOSLO imaging have the potential to become useful clinical biomarkers of disease activity and response to treatment.","National Eye Institute of the National Institutes of Health under award numbers R01EY027301, P30EY026877, R01EY031360, R01EY032147, R01EY032669, Marrus Family Foundation, Wise Family Foundation, J Milbank Foundation, New York Eye & Ear Research Foundation, Jorge N. Buxton Microsurgical Foundation, Violett Charitable Foundation, Challenge Grant award from Research to Prevent Blindness",Otero-Marquez,Oscar,"New York Eye and Ear Infirmary",Migacz,Justin,"New York Eye and Ear Infirmary",Zhou,Davis,"New York Eye and Ear Infirmary",Pinhas,Alexander,"New York Eye and Ear Infirmary",Castanos,Maria,"New York Eye and Ear Infirmary",Ahsanuddin,Sofia,"New York Eye and Ear Infirmary",Rickford,Kara,"New York Eye and Ear Infirmary",Murillo,Brian,"New York Eye and Ear Infirmary",Zhou,Rebecca,"New York Eye and Ear Infirmary",Spellman,Lily,"New York Eye and Ear Infirmary",Sredar,Nrupin,"Stanford University",Gillette,Peter,"Kings County Hospital",Weitz,Rishard,"New York Eye and Ear Infirmary",Glassberg,Jeffrey,"Icahn School of Medicine at Mount Sinai",Dubra,Alfredo,"Stanford University",Chui,Toco,"New York Eye and Ear Infirmary"
1,8,4,31,"Invited Talk","In vivo study of higher-order retinal hemodynamics in human retinal capillaries",Zhang,Yuhua,"Doheny Eye Institute, Department of Ophthalmology, University of California - Los Angeles","Pulsatile erythrocyte flow in human retinal capillaries reflects the capillary-blood flow system's mechanical condition and represents a fundamental functioning aspect of retinal microcirculation. Inside the capillary, the erythrocytes are continuously accelerated and decelerated by systemic pressure and hydrostatic and osmotic pressures periodically with the heartbeat. This process can be described by the Navier-Stokes equation: ρ(∂v/∂t+v∙∇v)=-∇P+∇∙T, ρ is the density, v is the velocity, P is the pressure, and T represents the stress tensor. The time variation of the flow velocity (∂v/∂t), i.e., the acceleration, is a higher-order dynamics term (compared to velocity) of the pulsatile flow, reflects the temporal variation of the hemodynamic forces, and informs the dynamic mechanical properties of the erythrocyte-capillary system. Higher-order dynamics relating to the acceleration of the erythrocytes in retinal capillaries have not been investigated in the human eye due to inadequate technical measures. This study aims to characterize the higher-order retinal hemodynamics and identify sensitive biomarkers for quantifying age-related changes in the retinal microcirculation using high-speed adaptive optics near-confocal ophthalmoscopy. In human subjects in normal physical health with different ages, we demonstrate that higher-order hemodynamic characteristics of the erythrocyte flow in the retinal capillary can disclose age-related differences in the retinal microcirculation.","NIH R01EY024378), W. M. Keck Foundation, Carl Marshall Reeves & Mildred Almen Reeves Foundation, and Research to Prevent Blindness/Dr. H. James and Carole Free Catalyst Award for Innovative Research Approaches for AMD.",,,,,,,,,,,,,,,,,,,,,,,,,,,,,,,,,,,,,,,,,,,,,,,,
12,9,1,32,"Contributed Talk","In vivo calcium imaging of macaque foveolar retinal ganglion cells reveals spatiochromatic receptive field properties",Godat,Tyler,"University of Rochester","Here, we optically record responses to spatial and chromatic stimuli using a calcium indicator in the living macaque eye to characterize the receptive field (RF) properties of retinal ganglion cells (RGCs) serving the foveal center. GCaMP6s was expressed in three female macaques. Adaptive optics ophthalmoscopy was used to image fluorescence (488nm ex, 520/35nm em) from RGCs whose RF centers were driven by cones in the central 36 arcmin of the fovea and additional RGCs driven by cones in the central 6 arcmin of the foveola. Using cone isolating and luminance flicker (1.3deg, 0.15Hz, LED 420nm, 530nm, 660nm), we derived cone weights in over 250 RGCs. Using drifting gratings (1.9deg, 6Hz, 4-50c/deg, 561nm), we derived the spatial frequency responses of 15 L vs. M cone opponent RGCs at the foveolar center. Employing computational modeling (ISETbio), we inferred the full spatial difference of gaussians center and surround structure for those 15 cells. Of the 34 foveolar RGCs, 44% exhibited L vs. M cone opponency, 15% were L+M ON, 6% were -L-M OFF, and 35% showed only L or only M responses. The spatial frequency response functions of 12/15 L vs. M opponent cells peaked at high spatial frequencies (25-40c/deg) and had a strong bandpass characteristic. Our model indicates that the responses of all 15 L vs. M opponent cells are consistent with single cone input to their RF centers and that our data are consistent with extrafoveal data when the blurring of the optics is accounted for.","This work was supported by the National Eye Institute through grants NIH EY007125, NIH U01EY025497, NIH EY031467, NIH EY021166, and through an unrestricted grant to the Flaum Eye Institute from Research to Prevent Blindness.",Cottaris,"Nicolas P.","University of Pennsylvania",Patterson,Sara,"University of Rochester",Kohout,Kendall,"University of Rochester",Parkins,Keith,"University of Rochester",Yang,Qiang,"University of Rochester",Strazzeri,"Jennifer M.","University of Rochester Medical Center",McGregor,"Juliette E.","University of Rochester",Brainard,"David H.","University of Pennsylvania",Merigan,"William H.","University of Rochester",Williams,"David R.","University of Rochester",,,,,,,,,,,,," ",,,,,
4,9,2,33,"Contributed Talk","Identifying Specific Neural Substrates for Bayesian-like Computations in Binocular Vision and Multisensory Processing",Billock,"Vincent A.","Leidos, Inc. at the Naval Aerospace Medical Research Laboratory, Naval Medical Research Unit - Dayton","Bayesian thinking is influential in vision but the grounding of Bayesian computation in wetware is poorly understood.  Bayesian reliability (inverse variance) weighting of inputs is predicted by Maximum Likelihood Estimation Theory and has some psychophysical support, but evidence for neural reliability weighting is sparse and neural modeling of reliability weighting is tricky.   However, reliability averaging is just one possible perceptual weighted average.  An alternative – nonlinear magnitude-weighted averaging – was suggested by Schrodinger in 1926 to account for suprathreshold binocular perception and is available to repurpose for other sensory cue combinations.  We identified macaque suppressive binocular neurons that implement nonlinear magnitude-weighted averaging and approximate Bayesian averaging, without suffering the computational difficulties that Bayesian averaging implies.  We then applied the binocular modeling to suppressive multisensory (visual-tactile, audio-tactile, and audio-visual) neurons.  Although magnitude-weighting is a better fit than reliability-weighted averaging for cortical firing rates (in all four cases and in three different species), nonlinear magnitude-weighted averaging is well correlated with reliability averaging.   Magnitude-weighted averaging could serve as a surrogate for Bayesian calculations; mildly suppressive binocular and multisensory bimodal neurons could be neural correlates of Bayesian-like computation in the brain.","MAM: NIH NS039460; KD: 1R01EY027402-02, T32EY007135, and core grant P30EY008126; VAB & AMP: Office of the Assistant Secretary of Defense for Health Affairs & the Defense Health Agency J9 Research and Health Directorate, Defense Health 6.7 Program #DP_67.2_17_J9_1757, work unit # H1814.  ",Dougherty,Kacie,"Princeton Neuroscience Institute, Princeton University",Meredith,"M. Alex","Dept. of Anatomy & Neurobiology, Virginia Commonwealth University",Preston,"Adam M.","Naval Aerospace Medical Research Laboratory, Naval Medical Research Unit - Dayton",,,,,,,,,,,,,,,,,,,,,,,,,,,,,,,,,,,,,,,
10,9,3,34,"Contributed Talk","Preclinical & clinical evaluation of flavoprotein fluorescence as a label-free biomarker of retinal mitochondrial stress",Heaster,Tiffany,Genentech,"Retinal oxidative stress is linked to the development and progression of various retinal diseases including AMD and glaucoma. In response to oxidative stress, flavoproteins within the electron transport chain become oxidized and autofluoresce upon blue light exposure. We investigated the specificity of flavoprotein fluorescence (FPF) to mitochondrial oxidative stress in retinal cells in vitro and its reliability as a clinical biomarker for longitudinal monitoring of glaucoma. Preclinical FPF evaluation assessed mitochondria-specific FPF and reactive oxygen species (ROS) in retinal cells via confocal microscopy to characterize response to injury and oxidative stress perturbations. FPF intensity was directly correlated with increased stress-induced mitochondrial ROS (R2=0.693), confirming FPF signal origin. Clinical FPF measurements were evaluated using the OcuMet Beacon, a noninvasive retinal metabolic imaging device. FPF images were collected at macular and peripapillary regions of patients with stable glaucoma or glaucoma suspects (n=52) during baseline and three-month follow-up visits. Macular and peripapillary FPF scores showed strong correlation between patient baseline and follow-up measurements (r=0.996, lens-adjusted r=0.937, 0.972). These results confirm the relationship between FPF and oxidative stress in retinal cells and highlight FPF as a reproducible clinical imaging biomarker, supporting further discovery in rodent disease models and additional patient cohorts.",Genentech,Kim,Julia,Genentech,"De Arrigunaga",Sofia,"Massachusetts Eye and Ear, Harvard Medical School",Kang,Joyce,"Massachusetts Eye and Ear, Harvard Medical School",Freeman,Sandra,"Massachusetts Eye and Ear, Harvard Medical School",Lin,Michael,"Massachusetts Eye and Ear, Harvard Medical School",Gao,Simon,Genentech,Friedman,David,"Massachusetts Eye and Ear, Harvard Medical School",Chang,Dolly,Genentech,Elstrott,Justin,Genentech,,,,,,,,,,,,,,,,,,,,,
9,9,4,35,"Contributed Talk","Characteristics of electrically-induced visual percepts in the first human with the Intracortical Visual Prosthesis",Barry,"Michael P","Illinois Institute of Technology","The Intracortical Visual Prosthesis (ICVP) consists of multiple wireless floating microelectrode arrays (WFMAs), each with 16 stimulating electrodes. Stimulation of these electrodes can potentially provide artificial vision for people who are blind. Twenty-five WFMAs were implanted in the right occipital visual cortex of a participant in an FDA-approved, NIH-sponsored Phase 1 clinical trial (NCT04634383). Here, we report characteristics of visual percepts elicited by the WFMAs (frequency: 200 Hz, cathodic phase duration: 200 µs, amplitude and train length up to 60 µA and 900 ms). Stimulation of single electrodes in 10 WFMAs and groups of 4 or more electrodes in 7 additional WFMAs consistently produced percepts during >10 sessions across approximately 3 months of testing. Phosphenes generated within a single WFMA were typically similar in appearance. Descriptions included configurations of rings, bright or dark dots, and constant or flickering bars, with sizes of 0.3–12° across. Phosphenes appeared as blueish-white, or occasionally orange, red, or having an iridescent texture. Ten WFMAs produced phosphenes within a 4° cluster centered 4° below and to the left of fixation. Phosphenes from 4 other WFMAs were located 4° below or 20° left of the cluster. When using these phosphenes to scan a virtual line, the participant was able to discriminate horizontal and vertical lines (46/51 correct, p < 10^−8, binomial test), and 45° and 135° diagonal lines (12/14 correct, p < 0.01).","NIH Grant # 4UH3NS095557-03",Sadeghi,Roksana,"Johns Hopkins University",Towle,"Vernon L","University of Chicago",Stipp,Kelsey,"Illinois Institute of Technology",Grant,Patricia,"The Chicago Lighthouse for People Who Are Blind or Visually Impaired",Lane,"Frank John","Illinois Institute of Technology",Szlyk,"Janet P","The Chicago Lighthouse for People Who Are Blind or Visually Impaired",Dagnelie,Gislin,"Johns Hopkins University",Troyk,"Philip R","Illinois Institute of Technology",,,,,,,,,,,,,,,,,,,,,,,,
3,10,1,36,"Contributed Poster","Dynamic visual processing in post-saccadic V1 visual responses of the marmoset monkey",Abrham,Yonatan,"Brain and Cognitive Sciences, University of Rochester","All animals with image-forming eyes sample visual information through a “saccade and fixate” pattern of eye movements (Land and Nilsson, 2012). Here, we investigated how perisaccadic neural responses during free-viewing of natural images relate to the tuning properties of neurons in primary visual cortex (V1). We recorded from V1 in two marmoset monkeys using linear arrays as they freely viewed full-field natural scenes. We found that on average neural responses time-locked to saccade onset exhibited an early suppression followed by a post-saccadic rebound in excitatory activity. To determine whether the latency of these saccade dynamics varied with neural tuning properties we mapped tuning for spatial and temporal frequency, and orientation selectivity. In those trials marmosets free-viewed flashed full-field gratings that varied in spatial frequency and orientation. Among the neurons with significant orientation tuning, we observe a significant correlation between spatial frequency preference and the latency of post-saccadic rebound, with neurons tuned to higher spatial frequencies responding later. These results support the idea that neural responses during the saccade-fixation cycle follow coarse-to-fine distinctions proposed to operate in early visual processing (Burr, 1981; Watt, 1987; Hedge, 2008, Boi et al., 2017). ","JFM from NIH EY030998; JY from NIH R00EY032179",Yates,Jacob,"Vision Sciences, University of California at Berkeley",Mitchell,"Jude F.","Brain and Cognitive Sciences, University of Rochester",,,,,,,,,,,,,,,,,,,,,,,,,,,,,,,,,,,,,,,,,,
12,10,2,37,"Contributed Poster","Retinal Changes Associated with Football-Related Concussions and Head Impacts",Atlas,"Jason B.","University of Rochester School of Medicine & Dentistry","This pilot study explored the sensitivity of retinal markers to CNS sequelae of concussive and subconcussive head hits. Three groups of college athletes were assessed at pre-season, post-season and 4-months later: Football players with a concussion history (FB+C) (n = 9), players without a concussion history (FB-C) (n = 11), and non-contact athletes (swimmers, track & field; Non-FB) (n = 12). Measures included optical coherence tomography (OCT), OCT angiography, electroretinography, and visual acuity testing. Head impacts during the season were tracked with in-helmet accelerometers. At pre-season, FB+C demonstrated thicker macular central subfields (CSF) (Hedge’s g (effect size) = 1.05, p = 0.02) and retinal nerve fiber layers (RNFL) (g = 0.81, p = 0.08), relative to other athletes. Differences in CSF thickness were also observed at post-season and follow-up (gs > 1.00, ps < 0.04), reflecting their non-short-term nature. RNFL was thicker in FB+C at post-season (g = 0.93, p = 0.06) but not later. Total head impacts during the season correlated with increases in CSF thickness from baseline to follow-up only (r = -0.53, p = 0.02). High intensity head impacts in particular correlated with increases in cup-to-disc ratio at post-season and follow-up (rs > 0.53, ps < 0.03). These data suggest that concussion history is associated with retinal changes that are not short-term, and that severe head impacts are associated with acute changes whose duration is not yet known.","The Schmitt Program on Integrative Neuroscience, in conjunction with the Del Monte Neuroscience Institute at the University of Rochester",Young,Mia,"University of Rochester Medical Center",Bertolace,Lyvia,"University of Rochester Medical Center",Juskiewicz,Iwona,"University of Rochester Medical Center",Abrham,Yonaton,"University of Rochester Medical Center",Merchant-Borna,Kian,"University of Rochester Medical Center",Dermady,Sarah,"University of Rochester Medical Center",Keane,Brian,"University of Rochester Medical Center, Department of Psychiatry",Ramchandran,"Rajeev S.","University of Rochester Medical Center, Department of Ophthalmology",Bazarian,Jeffrey,"University of Rochester Medical Center, Department of Emergency Medicine",Silverstein,Steven,"University of Rochester Medical Center, Department of Psychiatry",,,,,,,,,,,,," ",,,,,
9,10,4,38,"Contributed Poster","Estimation of scleral biomechanical properties from air-puff-coupled optical coherence tomography",Birkenfeld,"Judith S.","Instituto de Óptica ""Daza de Valdés"", Consejo Superior de Investigaciones Científicas (IO-CSIC), Madrid, Spain","Progression of myopia is usually accompanied by axial overgrowth of the eyeball, which affects scleral biomechanics (BM). To study scleral biomechanics, we propose the use of air-puff deformation swept-source OCT imaging. Air-puff deformation imaging was performed at different sites of ex vivo porcine (n=5) and rabbit (n=3) eyes, (<24hr postmortem): Nasal/temporal equatorial and posterior sclera (NE, NP, TE, TP), superior (S) and inferior (I) sclera, and cornea (C). Intraocular pressure was kept at 15mmHg. Deformation data were used as input to inverse finite element model (FEM) algorithms to reconstruct BM properties. Experimental deformation amplitudes showed dependence on the animal model, with porcine scleras exhibiting greater inter-site variation (displacement of S, I was up to four times greater than that of N, T), while rabbit scleras exhibited at most 40% of displacement differences between all sites. Both models showed significant (p<.001) differences in the temporal deformation profile between sclera and (C), but similarities in all scleral locations, suggesting that the scleral temporal profile is independent of scleral thickness variations. The FEM estimated an elastic modulus of 1.84 ± 0.30 MPa (I) to 6.04 ± 2.11 MPa (TE) for the porcine sclera. The use of scleral air-puff imaging is promising for noninvasive investigation of structural changes in the sclera associated with myopia and for monitoring possible modulation of scleral stiffness with myopia treatment.","Horizon 2020 Framework Programme European Project Imcustomeye (H2020-ICT-2017 Ref. 779960); European Research Council (2018-ADG-SILKEYE-833106); Spanish Government10.13039/100014440 (CSIC JAE Intro Fellowship); L'Oréal-UNESCO “For Women in Science” Spain; Spanish Government Juan de la Cierva-Incorporation Fellowship (IJC2018-037508-I); Spanish Government PID2020-115191RB-I00; Fundacja na rzecz Nauki Polskiej (MAB/2019/12); National Agency for Academic Exchange, Polish Government (NAWA ULAM/2020/1/00176); NIH NIE P30EY 001319; Unrestricted Funds Research to Prevent Blindness, NY",Villegas,Lupe,"Instituto de Óptica ""Daza de Valdés"", Consejo Superior de Investigaciones Científicas (IO-CSIC), Madrid, Spain","de la Hoz","Andrés ","Instituto de Óptica ""Daza de Valdés"", Consejo Superior de Investigaciones Científicas (IO-CSIC), Madrid, Spain",Bronte-Ciriza,David,"CNR – IPCF, Istituto per i Processi Chimico-Fisici, Messina, Italy",Varea,Alejandra,"Instituto de Óptica ""Daza de Valdés"", Consejo Superior de Investigaciones Científicas (IO-CSIC), Madrid, Spain",Martínez-Enríquez,Eduardo,"Instituto de Óptica ""Daza de Valdés"", Consejo Superior de Investigaciones Científicas (IO-CSIC), Madrid, Spain",Curatolo,Andrea,"ICTER and Institute of Physical Chemistry, Polish Academy of Sciences, Warsaw, Poland",Germann,"James A.","Instituto de Óptica ""Daza de Valdés"", Consejo Superior de Investigaciones Científicas (IO-CSIC), Madrid, Spain",Marcos,Susana,"The Center for Visual Science, University of Rochester, Rochester, New York, USA",,,,,,,,,,,,,,,,,,,,,,,,
